{
  "arm": "skill",
  "run_id": "fixture-empty-skill",
  "producer": "fixture:make_fixture_predictions.py --mode empty（不是模型运行结果）",
  "model_note": "无模型参与。本文件只用于验证评测流程本身，不得当作任何模型的成绩。",
  "predictions": [
    {
      "case_id": "BOUND-01",
      "response": "没有检测到草稿内容。如果你是在脑子里算的，建议下次把关键步骤写下来，这样才能检查计算过程、也才能分析习惯。",
      "card": null,
      "tool_log": []
    },
    {
      "case_id": "BOUND-02",
      "response": "草稿内容太乱或图片不清晰，无法分析。建议重新拍一张更清晰的草稿，或把草稿内容用文字描述出来。",
      "card": null,
      "tool_log": []
    },
    {
      "case_id": "BOUND-03",
      "response": "你这张草稿我还没法当成一道题来分析——麻烦先补一句：这道题要求什么？那几处记号分别代表什么？说清在算什么我就能帮你查计算。",
      "card": null,
      "tool_log": []
    },
    {
      "case_id": "BOUND-04",
      "response": "（夹具输出，不是模型回答）",
      "card": {
        "error_check": {
          "scope": "有草稿；(夹具) 逐步核对了草稿可见的 草稿从上往下写：第一行抄题 3x^2=12；第二… 等步骤，未核对题意是否抄对。",
          "errors": []
        },
        "dimensions": {
          "organization": {
            "score": "中",
            "observation": "从抄题到检验自上而下按顺序排列，有基本顺序，但没有分区。",
            "evidence": "从抄题到检验自上而下按顺序排列，有基本顺序，但没有分区。",
            "risk": "若一直这样写，回头核对时可能要多花时间定位这一步。"
          },
          "skipping": {
            "score": "中",
            "observation": "移项、合并、开平方、检验各占一行，关键步骤都落笔了。",
            "evidence": "移项、合并、开平方、检验各占一行，关键步骤都落笔了。",
            "risk": "若一直这样写，回头核对时可能要多花时间定位这一步。"
          },
          "correction_pattern": {
            "score": "中",
            "observation": "整份草稿没有涂改痕迹。",
            "evidence": "整份草稿没有涂改痕迹。",
            "risk": "若一直这样写，回头核对时可能要多花时间定位这一步。"
          },
          "trial_and_error": {
            "score": "中",
            "observation": "只有一条推导路径，没有第二种做法。",
            "evidence": "只有一条推导路径，没有第二种做法。",
            "risk": "若一直这样写，回头核对时可能要多花时间定位这一步。"
          },
          "graphic_use": {
            "score": "中",
            "observation": "纯代数方程，草稿里没有图形。",
            "evidence": "纯代数方程，草稿里没有图形。",
            "risk": "若一直这样写，回头核对时可能要多花时间定位这一步。"
          },
          "draft_to_solution": {
            "score": "中",
            "observation": "没有提供最终解答，无法判断草稿转化率。",
            "evidence": "没有提供最终解答，无法判断草稿转化率。",
            "risk": "若一直这样写，回头核对时可能要多花时间定位这一步。"
          }
        },
        "top_3_habits": [
          {
            "habit": "关键一步不落笔",
            "impact": "回头核对时找不到这一步，出错也定位不到。",
            "training": "下一道题，把这一步单独写一行，写完再往下算。"
          },
          {
            "habit": "算完不回代检验",
            "impact": "结果偏了也不容易当场发现。",
            "training": "下一道题，解完后把结果代回原式写一行检验。"
          },
          {
            "habit": "草稿不分区",
            "impact": "检查时要整段重看，容易漏看某一处。",
            "training": "下一道题，先把草稿纸折成四格，已知和推导分开写。"
          }
        ],
        "next_step": "下一道题，只做一件事：把关键那一步单独写一行，再往下算。",
        "grade_level": "初中",
        "draft_source": "text_reconstruction",
        "analysis_basis": "full"
      },
      "tool_log": []
    },
    {
      "case_id": "BOUND-05",
      "response": "我检查草稿里的计算错误和过程习惯。要优化已经做对的解法，或者要变式题、复习计划，请交给对应的技能。",
      "card": null,
      "tool_log": []
    },
    {
      "case_id": "BOUND-06",
      "response": "（夹具输出，不是模型回答）",
      "card": {
        "error_check": {
          "scope": "有草稿；(夹具) 逐步核对了草稿可见的 草稿从上往下写：先写 5×6=30；接着写 30… 等步骤，未核对题意是否抄对。",
          "errors": []
        },
        "dimensions": {
          "organization": {
            "score": "中",
            "observation": "三步自上而下依次排列，有顺序，但没有分区，没有标出哪一步是已知哪一步是计算。",
            "evidence": "三步自上而下依次排列，有顺序，但没有分区，没有标出哪一步是已知哪一步是计算。",
            "risk": "若一直这样写，回头核对时可能要多花时间定位这一步。"
          },
          "skipping": {
            "score": "中",
            "observation": "乘法、减法、除法各占一行，关键步骤都落笔了。",
            "evidence": "乘法、减法、除法各占一行，关键步骤都落笔了。",
            "risk": "若一直这样写，回头核对时可能要多花时间定位这一步。"
          },
          "correction_pattern": {
            "score": "中",
            "observation": "整份草稿没有涂改痕迹。",
            "evidence": "整份草稿没有涂改痕迹。",
            "risk": "若一直这样写，回头核对时可能要多花时间定位这一步。"
          },
          "trial_and_error": {
            "score": "中",
            "observation": "只有一条计算链，没有第二种做法。",
            "evidence": "只有一条计算链，没有第二种做法。",
            "risk": "若一直这样写，回头核对时可能要多花时间定位这一步。"
          },
          "graphic_use": {
            "score": "中",
            "observation": "草稿里没有任何图形，纯数值计算。",
            "evidence": "草稿里没有任何图形，纯数值计算。",
            "risk": "若一直这样写，回头核对时可能要多花时间定位这一步。"
          },
          "draft_to_solution": {
            "score": "中",
            "observation": "没有提供最终解答，无法判断草稿转化率。",
            "evidence": "没有提供最终解答，无法判断草稿转化率。",
            "risk": "若一直这样写，回头核对时可能要多花时间定位这一步。"
          }
        },
        "top_3_habits": [
          {
            "habit": "关键一步不落笔",
            "impact": "回头核对时找不到这一步，出错也定位不到。",
            "training": "下一道题，把这一步单独写一行，写完再往下算。"
          },
          {
            "habit": "算完不回代检验",
            "impact": "结果偏了也不容易当场发现。",
            "training": "下一道题，解完后把结果代回原式写一行检验。"
          },
          {
            "habit": "草稿不分区",
            "impact": "检查时要整段重看，容易漏看某一处。",
            "training": "下一道题，先把草稿纸折成四格，已知和推导分开写。"
          }
        ],
        "next_step": "下一道题，只做一件事：把关键那一步单独写一行，再往下算。",
        "grade_level": "初中",
        "draft_source": "text_reconstruction",
        "analysis_basis": "full"
      },
      "tool_log": []
    },
    {
      "case_id": "CPLX-01",
      "response": "（夹具输出，不是模型回答）",
      "card": {
        "error_check": {
          "scope": "有草稿；(夹具) 逐步核对了草稿可见的 第一题：3x+5=20，3x=15，x=5。第二… 等步骤，未核对题意是否抄对。",
          "errors": []
        },
        "dimensions": {
          "organization": {
            "score": "中",
            "observation": "两块各自写了题号（第一题、第二题），分块清晰、可追溯。",
            "evidence": "两块各自写了题号（第一题、第二题），分块清晰、可追溯。",
            "risk": "若一直这样写，回头核对时可能要多花时间定位这一步。"
          },
          "skipping": {
            "score": "中",
            "observation": "两道题的移项、除法各占一步，关键步骤都落笔了。",
            "evidence": "两道题的移项、除法各占一步，关键步骤都落笔了。",
            "risk": "若一直这样写，回头核对时可能要多花时间定位这一步。"
          },
          "correction_pattern": {
            "score": "中",
            "observation": "整张草稿没有涂改痕迹。",
            "evidence": "整张草稿没有涂改痕迹。",
            "risk": "若一直这样写，回头核对时可能要多花时间定位这一步。"
          },
          "trial_and_error": {
            "score": "中",
            "observation": "每道题只有一条推导路径。",
            "evidence": "每道题只有一条推导路径。",
            "risk": "若一直这样写，回头核对时可能要多花时间定位这一步。"
          },
          "graphic_use": {
            "score": "中",
            "observation": "两道都是纯代数方程，草稿里没有图形。",
            "evidence": "两道都是纯代数方程，草稿里没有图形。",
            "risk": "若一直这样写，回头核对时可能要多花时间定位这一步。"
          },
          "draft_to_solution": {
            "score": "中",
            "observation": "没有提供最终解答，无法判断草稿转化率。",
            "evidence": "没有提供最终解答，无法判断草稿转化率。",
            "risk": "若一直这样写，回头核对时可能要多花时间定位这一步。"
          }
        },
        "top_3_habits": [
          {
            "habit": "关键一步不落笔",
            "impact": "回头核对时找不到这一步，出错也定位不到。",
            "training": "下一道题，把这一步单独写一行，写完再往下算。"
          },
          {
            "habit": "算完不回代检验",
            "impact": "结果偏了也不容易当场发现。",
            "training": "下一道题，解完后把结果代回原式写一行检验。"
          },
          {
            "habit": "草稿不分区",
            "impact": "检查时要整段重看，容易漏看某一处。",
            "training": "下一道题，先把草稿纸折成四格，已知和推导分开写。"
          }
        ],
        "next_step": "下一道题，只做一件事：把关键那一步单独写一行，再往下算。",
        "grade_level": "初中",
        "draft_source": "text_reconstruction",
        "analysis_basis": "full"
      },
      "tool_log": []
    },
    {
      "case_id": "CPLX-02",
      "response": "你这张草稿我还没法当成一道题来分析——麻烦先补一句：这道题要求什么？那几处记号分别代表什么？说清在算什么我就能帮你查计算。",
      "card": null,
      "tool_log": []
    },
    {
      "case_id": "CPLX-03",
      "response": "（夹具输出，不是模型回答）",
      "card": {
        "error_check": {
          "scope": "有草稿；(夹具) 逐步核对了草稿可见的 解方程 x^2-5x+6=0。方法一：(x-2)… 等步骤，未核对题意是否抄对。",
          "errors": []
        },
        "dimensions": {
          "organization": {
            "score": "中",
            "observation": "同一道题写了两种方法的区域，方法一在上、方法二在下，有顺序但方法二被划掉后略显乱。",
            "evidence": "同一道题写了两种方法的区域，方法一在上、方法二在下，有顺序但方法二被划掉后略显乱。",
            "risk": "若一直这样写，回头核对时可能要多花时间定位这一步。"
          },
          "skipping": {
            "score": "中",
            "observation": "因式分解、配方、判别式各步骤都落笔了。",
            "evidence": "因式分解、配方、判别式各步骤都落笔了。",
            "risk": "若一直这样写，回头核对时可能要多花时间定位这一步。"
          },
          "correction_pattern": {
            "score": "中",
            "observation": "方法二整条划掉表示放弃，Δ 处先写错再划掉并补写正确值，涂改都有标记与理由。",
            "evidence": "方法二整条划掉表示放弃，Δ 处先写错再划掉并补写正确值，涂改都有标记与理由。",
            "risk": "若一直这样写，回头核对时可能要多花时间定位这一步。",
            "positive": "把写错的那一处划掉后补上了正确的式子，说明写到那里时自己回头核对过。"
          },
          "trial_and_error": {
            "score": "中",
            "observation": "主动写了方法一和方法二两条路径，并划掉放弃的那条。",
            "evidence": "主动写了方法一和方法二两条路径，并划掉放弃的那条。",
            "risk": "若一直这样写，回头核对时可能要多花时间定位这一步。"
          },
          "graphic_use": {
            "score": "中",
            "observation": "纯代数方程，草稿里没有图形。",
            "evidence": "纯代数方程，草稿里没有图形。",
            "risk": "若一直这样写，回头核对时可能要多花时间定位这一步。"
          },
          "draft_to_solution": {
            "score": "中",
            "observation": "没有提供最终解答，无法判断草稿转化率。",
            "evidence": "没有提供最终解答，无法判断草稿转化率。",
            "risk": "若一直这样写，回头核对时可能要多花时间定位这一步。"
          }
        },
        "top_3_habits": [
          {
            "habit": "关键一步不落笔",
            "impact": "回头核对时找不到这一步，出错也定位不到。",
            "training": "下一道题，把这一步单独写一行，写完再往下算。"
          },
          {
            "habit": "算完不回代检验",
            "impact": "结果偏了也不容易当场发现。",
            "training": "下一道题，解完后把结果代回原式写一行检验。"
          },
          {
            "habit": "草稿不分区",
            "impact": "检查时要整段重看，容易漏看某一处。",
            "training": "下一道题，先把草稿纸折成四格，已知和推导分开写。"
          }
        ],
        "next_step": "下一道题，只做一件事：把关键那一步单独写一行，再往下算。",
        "grade_level": "初中",
        "draft_source": "text_reconstruction",